{
  "$schema": "https://json-schema.org/draft/2020-12/schema",
  "type": "object",
  "additionalProperties": false,
  "required": ["name", "definition", "metadata"],
  "properties": {
    "name": {"type": "string", "minLength": 1},
    "description": {"type": "string", "minLength": 1},
    "definition": {
      "type": "object",
      "additionalProperties": false,
      "required": ["kind", "model", "instructions"],
      "properties": {
        "kind": {"const": "prompt"},
        "model": {"const": "gpt-5.4-mini"},
        "instructions": {"type": "string", "minLength": 1}
      }
    },
    "metadata": {
      "type": "object",
      "additionalProperties": false,
      "required": ["logical_version"],
      "properties": {
        "logical_version": {
          "anyOf": [
            {"const": "v0"},
            {"type": "string", "pattern": "^issue-[0-9]{3}$"}
          ]
        },
        "traffic_class": {"type": "string", "minLength": 1},
        "data_class": {"type": "string", "minLength": 1},
        "conversation_memory": {"type": "string", "minLength": 1},
        "max_output_tokens": {"type": "string", "minLength": 1}
      }
    }
  }
}
